<?xml version="1.0" encoding="utf-8"?>
<!DOCTYPE suite SYSTEM "lu-uia-suite.dtd" >
<suite name="Test" description="测试用例集">
    <cases exec-before-test="false" exec-after-test="false">
        <before-test-cases purpose="测试前准备" preserve-order="true">
            <case id="1" title="测试前用例一" priority="2">
                <step id="1" src-page-name="测试前页面1" method="shortTapById" dest-page-name="测试前页面3" snapshoot="true" step-desc="滑动启动图至最后一页" >
                    <assert-key value="立即体验按钮" location-type="id" compare-value="sqlMapId:*/jetjiang" />
                </step>
                <step id="2" src-page-name="测试前页面3" method="shortTapById" dest-page-name="测试前页面4" snapshoot="true" step-desc="进陆金所APP首页" >
                    <method-param name="elemId" type="element-id" value="com.lufax.android://tsx1" />
                    <assert-key value="com.lufax.android://tsv1" location-type="id" compare-value="sqlMapId:*/jetjiang1" />
                </step>
            </case>
        </before-test-cases>

        <test-cases purpose="测试基金搜索功能" preserve-order="true">
            <case id="2" title="进投资理财列表页" priority="1">
                <step id="1" src-page-name="MainPage" method="testPrint1" dest-page-name="JiJinInFinancePage" snapshoot="true" step-desc="点击投资理财，进投资理财列表页" >
                    <method-param name="param1" value="helloworldofprint1" />
                    <method-param name="param2" value="2"></method-param>
                    <method-param name="param3" value="3"></method-param>
                    <assert-key value="com.lufax.android://tsv2" location-type="xpath"  compare-value="sqlMapId:*/jetjiang2"/>
                </step>
                <step id="2" src-page-name="MainPage" method="testPrint2" dest-page-name="JiJinInFinancePage" snapshoot="true" step-desc="点击基金，进投资理财基金列表页" >
                    <method-param name="param1" value="helloworldofprint2" />
                    <method-param name="param2" value="2"></method-param>
                    <method-param name="param3" value="3"></method-param>
                    <assert-key value="com.lufax.android://tsv3" location-type="xpath"  compare-value="sqlMapId:*/jetjiang3"/>
                </step>
            </case>
            <case id="1" title="进投资理财列表页" priority="1">
                <step id="1" src-page-name="MainPage" method="testPrint3" dest-page-name="JiJinInFinancePage" snapshoot="true" step-desc="点击投资理财，进投资理财列表页" >
                    <method-param name="param1" value="1" />
                    <method-param name="param2" value="2"></method-param>
                    <method-param name="param3" value="helloworldofprint3"></method-param>
                    <assert-key value="com.lufax.android://tsv2" location-type="xpath"  compare-value="sqlMapId:*/jetjiang2"/>
                </step>
                <step id="2" src-page-name="MainPage" method="testPrint4" dest-page-name="JiJinInFinancePage" snapshoot="true" step-desc="点击基金，进投资理财基金列表页" >
                    <method-param name="param1" value="1" />
                    <method-param name="param2" value="helloworldofprint4"></method-param>
                    <method-param name="param3" value="3"></method-param>
                    <assert-key value="com.lufax.android://tsv3" location-type="xpath"  compare-value="sqlMapId:*/jetjiang3"/>
                </step>
            </case>
        </test-cases>

        <after-test-cases purpose="测试后清理" preserve-order="true">
            <case id="1" title="关闭appium driver" priority="2">
                <step id="1" src-page-name="基金搜索结果页" method="shortTapById" dest-page-name="手机桌面" snapshoot="true" step-desc="关闭appium driver" >
                    <assert-key value="com.lufax.android://tsv5" location-type="id" compare-value="桌面" />
                </step>
            </case>
        </after-test-cases>
    </cases>
</suite>